Toppling Shah Saddam Gaddafi geopolitical catastrophes delete account Realpolitik,0
RT RiskyRoast cursedsalad Bernard Henri Levy man supported killed people Kiev killed Gaddafi ,0
Hafer,0
Breaking news Dtaa scientist goes jail selling statistics Khalifa Haftar vs Saif al Islam Gaddafi ,1
RT GrayConnolly Toppling Shah Saddam Gaddafi geopolitical catastrophes delete account Realpolitik https co wfS D ,0
On way overthrow get rid Saddam Hussein Muammar Gaddafi US Senator Lindsay Graham fingerprint overthrow mentioned,0
Libya SAS ready seize Col Gaddafi stores mustard gas Telegraph https co RJaf Q Vfo,0
RT RiskyRoast cursedsalad Bernard Henri Levy man supported killed people Kiev killed Gaddafi ,0
Hafer Hafer Haftar Haftar Hafar Hafar Haftar,1
RT RiskyRoast cursedsalad Bernard Henri Levy man supported killed people Kiev killed Gaddafi ,0
RT GrayConnolly Toppling Shah Saddam Gaddafi geopolitical catastrophes delete account Realpolitik https co wfS D ,0
"fall gaddafi regime days later, france israel preparing develop tactical plans fast positioning straying important positions africa supreme goal dominate africa reduce influence libyan hegemony emptying completely libyan investments",0
saleh al-fadhalah leave departed saddam tyrant leave departed hosni mubarak client leave gaddafi departed madness leave ali abdullah saleh left traitor leave rotten racist seizing money people go garbage history afraid give chair one reveals thefts attacks bidoon,0
rt azmanimouhieddi bernard henri levy man supported killed people kiev killed gaddafi ,0
rt riskyroast cursedsalad bernard henri levy man supported killed people kiev killed gaddafi ,0
gaddafi's investments africa lost succession,0
"british intelligence agent, liar calls saif al-islam gaddafi, seen pride barbaric crusader nato blooded lib",0
killing gaddafi saddam mistake support putin donald trump https co niocycourw,0
way overthrow get rid saddam hussein muammar gaddafi us senator lindsay graham fingerprint overthrow mentioned,0
gaddafi's investments africa lost successively arab,0
"fall gaddafi regime days ago, france israel drawing preparing plans strategies positioning entrenchment within strategic positions africa. sami's goal reduce libyan influence domination africa employ possibilities empty africa libyan investments",0
"response directed erdogan's statement, mainly though france also fair side. sarkozy libya retaliation gaddafi, victory democracy.",0
rt riskyroast cursedsalad bernard henri levy man supported killed people kiev killed gaddafi ,0
see gaddafi gaddafi,0
"hafer ashraf you, daashi, corrupt",1
"killing gaddafi libya, qatar stole libyan satellite named suhail sat brotherhood libyan branch libyan satellite launched",0
gaddafi's investments africa lost succession,0
whoever attended meeting prepares watch king new kings arab islamic nations instead gaddafi try states recognize,0
rt grayconnolly toppling shah saddam gaddafi geopolitical catastrophes delete account realpolitik https co wfs ,0
think hard gaddafi supporting rights libyans transsexuals libya. one million per cent based leadership,0
gaddafi's investments africa lost succession,0
rt riskyroast cursedsalad bernard henri levy man supported killed people kiev killed gaddafi ,0
whoever attended meeting prepares watch king new kings arab islamic nations instead gaddafi try states recognize,0
pseudo philosopher jesuisbhl instigator destruction libya know advocate forced regime change france fate macron similar gaddafi parisriots gilletsjaunes,0
rt riskyroast cursedsalad bernard henri levy man supported killed people kiev killed gaddafi ,0
khalifa belkacem hafter,1
hafer,1
rt riskyroast cursedsalad bernard henri levy man supported killed people kiev killed gaddafi ,0
gaddafi's investments africa lost successively arab,0
"egypt gets last place education level, gaddafi's statement bourguiba makes wonder cares education",0
"saif al-islam, son martyr mu'ammar al-qadhafi libya, sends letter french president demanding restraint release murderer",0
history hassan ii rejected gaddafi's request participate green march western sahara,0
hafer,1
original reason divorce muammar gaddafi's marriage,0
use vacation excuse escape outbreak french demonstrations comment defense government france coincides return talk khashoggi attempt return subject flags island turks revolve around talk qatari regime withdrawal jinn supporting terrorism gaddafi's recordings,0
rt grayconnolly toppling shah saddam gaddafi geopolitical catastrophes delete account realpolitik https co wfs ,0
gaddafi's investments africa lost successively arab,0
hafer,1
fate gaddafi,0
rt azmanimouhieddi bernard henri levy man supported killed people kiev killed gaddafi ,0
gaddafi's investments africa lost successively arab,0
gaddafi's investments africa lost successively arab,0
dreams madri shtibi dreamed gaddafi call sheep market,0
gaddafi's investments africa lost detail,0
 nitinkapoor worked destroyed libya ten things gaddafi want know https co ofiuonuva ,0
hafer,1
"arab countries shaky boycott hamdeen regime, responsible killing destruction arab world. muammar gaddafi regime provided three arab capitals, including riyadh, entire office showing conspiracy hamdeen",0
gaddafi,0
rt shoebridgec depth report examines chaos carnage corruption deep disillusionment libya following gaddafi overthrow ,0
gaddafi's investments africa lost successively arab,0
rt grayconnolly toppling shah saddam gaddafi geopolitical catastrophes delete account realpolitik https co wfs ,0
"tel aviv angry angry egypt because, despite military security assistance it, america, france, britain khalifa hafter failed eliminate terrorism sinai",1
rt lyobserver haftar conte discuss support un envoy palermo conference libya italy https co brztnw pr ,1
khalifa belkacem hafter,1
"meant egyptian haftar, egyptian, el-mardoum t-hua, army libya, kamsha froukh, dispossessed uae",1
gaddafi,0
able respond question whether recordings hamdab khalifa muammar gaddafi assassination king abdullah recordings hamad bin jabr us intelligence division saudi state altnkr records recognized hamdine father zaq traitor like,0
khalifa belkacem hafter,1
hafer,1
rt azmanimouhieddi bernard henri levy man supported killed people kiev killed gaddafi ,0
rt azmanimouhieddi bernard henri levy man supported killed people kiev killed gaddafi ,0
agreed upon king abdullah day sent registration hear came servants take demon qatar everyone knows subject mind separate registration king gaddafi great disagreement registration arrived qatar,0
khalifa belkacem hafter excellent person,1
rt riskyroast cursedsalad bernard henri levy man supported killed people kiev killed gaddafi ,0
macaron gaddafi number become revolution libya gaddafi surfaced rebels macaron wearing yellow jacket possibility entering attic palace kill fate fate gaddafi almighty god possibility god avenge france gaddafi,0
rt gaddafi created transgender rights https co zm ata k,0
rt grayconnolly toppling shah saddam gaddafi geopolitical catastrophes delete account realpolitik https co wfs ,0
muammar gaddafi,0
"macaron came demonstrators yellow jackets emerging government, gaddafi him, succeeded schizophrenic",0
 mitchellvii know lot leaders inculed forgotting happen gaddafi people got ahold people lot worst ever,0
rt riskyroast cursedsalad bernard henri levy man supported killed people kiev killed gaddafi ,0
saleh al-fadhalah leave departed saddam tyrant leave departed hosni mubarak client leave gaddafi departed madness leave ali abdullah saleh left traitor leave rotten racist seizing money people go garbage history afraid give chair one reveals thefts attacks bidoon,0
 randpaul president secretary state killed gaddafi pay war crimes give turds kassogi,0
"thinking media reason number reasons one overthrew kingdoms raise others, north korea falling years, russia china, drops personal person gaddafi personality bashar dog personality mubarak personality benefit injustice reason president information vector event",0
let us see gaddafi,0
people france come carry flag libya raise pictures gaddafi say conqueror,0
new clintons reality tv show gaddafi loved ,0
mu'ammar al-gaddafi companions,0
voice important enter link vote libya calls sons support engineer saif al-islam gaddafi president rebuilding state complete projects libya tomorrow participated referendum following link,0
support engineer saif al-islam gaddafi president rebuilding state,0
"president france, emmanuel macaron, sarkozy, need him. think hand, year so, ask end every year life, president libya say muammar gaddafi bouteflika. algeria",0
whoever attended meeting prepares watch king new kings arab islamic nations instead gaddafi try states recognize,0
"qatar plagued alntaij offer hait beyond explain generations recognize real enemy doha, many asya know generations young people fooled soft skin qatar inform friendship gaddafi qatar assassination attempt teach support coup king salman know die qatar",0
rt riskyroast cursedsalad bernard henri levy man supported killed people kiev killed gaddafi ,0
visit hafer group known,1
 luke tech wonder happen leaders start waking realizing treating people worst gaddafi happen lololol,0
libya's investments gaddafi africa lost succession,0
 daddydaddymac phyddledd sweetheart ending gaddafi one sword ass ,0
"happens mob evil, france killed gaddafi flew planes libya cooperation england looted gold dollar improve economy bottom colonial state since creation currently pays price",0
"talks muammar gaddafi words hamad al-saghir, foreign minister, well famous speech, relations israel, pressure saudi arabia, support outsiders bahrain, intervene libya, support brotherhood egypt. short, qatari politics deal rejectionist ideology,",0
gaddafi ahead time lgbt icon ,0
"course, men, soul kadhafi, help god, blow hafer sisi, men egypt rise him, blow blow servants him.",0
al sirraj invites haftar tripoli strategypage reports https co ukk eberk https co kxflbqs fi,1
"know people trying exploit happening france directly indirectly justify suppression gaddafi libyan people demonstrations justify bullets hit demonstrators field martyrs, tajoura fashloum zawia comparative brother exist",0
 karlremarks macron gaddafi europe joins giletsjaunes protests https co xfysul l ,0
tire glorify personalities applauding glorifying gaddafi fall applauded abdel jalil alkib applause still occupied faces died children left behind good citizen still house,0
win shim arabs give houthi ahadithat military sites saudi arabia united states death dozens saudi soldiers united arab know shim arabs win shim arabs heretical father orders gaddafi assassination king abdullah division saudi arabia like prostitute recommend honor,0
list richest presidents deposed world leaders arab autumn forefront wealth gaddafi alone surpass wealth richest man,0
"therefore, supported bashar carried coups hafar houthi al-da'ashi, iranian agent sisi. arab thinker says accused extremism imprisoned government west.",1
muammar gaddafi condemned france supporting saboteurs cause destruction,0
"brotherhood comedy ayishin narcissism spirit see manage obligations libya became rooms hafar american sheep went land pure kano tool one country dominated sheep, country successor al-shawaz al-qardgan fall still performs role wrote",1
"al-qadhafi may allaah mercy him said you people respect time prayer, enjoin good forbid evil.",0
rt azmanimouhieddi bernard henri levy man supported killed people kiev killed gaddafi ,0
rt alnabaa en al sirraj invites haftar tripoli strategypage reports https co ukk eberk https co kxflbqs fi,1
"macaron came demonstrators yellow jackets emerging government, gaddafi him, succeeded schizophrenic",0
anschlh interrupt broadcast shed poison rumors jordanian without hbl return work gaddafi sisi,0
province come vacuum hear betrayal prince aqq muammar gaddafi conspired saudi arabia prevent qatari hajj umrah saw recordings qataris inside haram al-makki,0
haram al-doha hamad bin jassim gaddafi conspiring saudi arabia applies proverb alkhalp cried preceded complained media campaign saudi arabia wish exit gcc,0
gaddafi gadinho takes home pilsner man match award ondufc paidha ba upllive startimesupl pilsnerawards https co jvzks yzrm,0
god called french arab arab world substitute guilt iraq libya syria blood gaddafi days ndulha people,0
funny replies point boredom speak matter subject understand name name haftar,1
"macaron came demonstrators yellow jackets emerging government, gaddafi him, succeeded schizophrenic",0
 bigguccisokni kissing gaddafi ass one power switched real quick shit got real lmao talk rat,0
gaddafi's investments africa lost successively arab,0
nah gaddafi intervention leading libya civil war rise slave trade mistake ,0
 girlgibraltar nope libya descended human trafficking capital world gaddafi murdered iraq infiltrated extremists destabilized probably forever saddam hussein murdered ,0
"libya ruined league arab states asked nato bomb kill destroy sheikh qaradawi fatwa fatwa analyzes killing muammar gaddafi arab league ruined syria destruction yemen ahhik silence organization islamic cooperation, preferred euro dollar say truth",0
"egypt gets last place education level, gaddafi's statement bourguiba makes wonder cares education",0
list richest presidents deposed world leaders arab autumn forefront wealth gaddafi alone surpass wealth richest man,0
"yakhi al-fadhel happened arab countries revolutions, plan destroy dismantle countries, regardless dictatorial regime. kadhafi killed, libya destroyed, killing saddam destroyed, iraq destroyed, division kill assad, syria destroyed father's hatred people.",0
 call gaddafi pay gold cause money really worth shit piece paper promote propaganda keep debt know dick ,0
 garybrennernewj charliekirk ever known u know history well america exceptional faults pres trump understands america first means rebuilding country others flourish make transactions called business real racist overthrew gaddafi trump ,0
list richest presidents deposed world leaders arab autumn forefront wealth gaddafi alone surpass wealth richest man,0
"support french elite happened libya even know happening media lie, pretext human rights responding removal gaddafi role independence country africa rejection israel arab awareness arab issues well authorization libya chaos scene distortion islam",0
"god, spring france support gaddafi devastated libya",0
brave leaders like hillary clinton gaddafi came saw died https co h sum ro via youtube,0
wish overwhelming chaos destroy everything country support villain hafter destroyed country killed slaves,1
"mafish state person stood gaddafi general, suffers today, whether political, economic security problems",0
"god, spring france support gaddafi devastated libya",0
"egypt gets last place education level, gaddafi's statement bourguiba makes wonder cares education",0
gaddafi died left wonderful name worthy rats hahaha,0
gaddafi's investments africa lost succession,0
believe muammar gaddafi new smash bros soon,0
rt grayconnolly toppling shah saddam gaddafi geopolitical catastrophes delete account realpolitik https co wfs ,0
france done libya coup d'état gaddafi reaping fruit home jackets zero mohamed salah libya,0
"france, protests intensifying number detainees failed government prison. necessary learn bashar people sprayed chemicals. one person killed hour gaddafi people sprayed heavy machine guns",0
rt alnabaa en al sirraj invites haftar tripoli strategypage reports https co ukk eberk https co kxflbqs fi,1
rt gaddafi created transgender rights https co zm ata k,0
rt riskyroast cursedsalad bernard henri levy man supported killed people kiev killed gaddafi ,0
city darna free control heroes libyan arab army led haftar god's wisdom years control tails turkey qatar organized bottom,1
 geovazquez jillie realdonaldtrump geraldorivera saddam hussein hid hole gaddafi hid pipe donald hide mueller ,0
gaddafi's investments africa lost succession,0
us site alseraj invited hafer meet tripoli,1
us site alseraj invited hafer meet tripoli,1
rt gaddafi created transgender rights https co zm ata k,0
"revolutions collapse regimes killing gaddafi saddam ali abdullah saleh possible deteriorate countries vtkkri girl tawakul kerman yemenis revolution yemen nobel reward lived america, dropped strongest arab armies iraq syria failed overthrow egypt's strong army israel",0
us site alseraj invited hafer meet tripoli,1
 realdonaldtrump seems leaders must forgotting happen gaddafi people caught either courageous stupid,0
looks like gaddafi,1
hany gharbawi haftar gharawi aafs ali watching furjan rina shen badirwa haha,1
"egypt gets last place education level, gaddafi's statement bourguiba makes wonder cares education",0
gaddafi's quarter,0
quba gaddafi arrived france,0
even dreams competing gaddafi title king kings africa,0
support engineer saif al-islam gaddafi president rebuilding state,0
"records leak agreement government qatar saudi arabia know hidden plans gaddafi return meet hamad bin jassem, planner know use finally speak discuss lift halalvak surrounded name banner unification",0
mu anto filled streets blood libya sold gaddafi ally ashamed happened,0
azmi flies whatever situation whatever tragedy matter many members family died bombs assad israel gaddafi,0
azmi flies whatever situation whatever tragedy matter many members family died bombs assad israel gaddafi,0
"mean, feeling syria jews americans killed qaddafi jews americans also, boy barren americans jews. lie, curse, distortion facts mockery you. cities aleppo, birthplace, biggest victim fears. you, liars?",0
yashich hafter respectable hadeel aweys apologized yesterday re-apologized done mistake error ward enlarge topics need loyalty saudi arabia need proof,1
"mean, feeling syria jews americans killed qaddafi jews americans also, boy barren americans jews. lie, curse, distortion facts mockery you. cities aleppo, birthplace, biggest victim fears. you, liars?",0
us site alseraj invited hafer meet tripoli,1
gaddafi's tactic,0
"realized hopes aspirations revolutionaries brother brother rebel libya, happened departure gaddafi result",0
baghi circles spin destroyed libya killed muammar gaddafi,0
"bigger criminal emerged gaddafi named hafer stole revolution libyan people. unfortunately, support counterrevolution know befall",0
"sake oppressed, persecuted killed unjustly displaced homelands remain syria, libya yemen, let enjoy demonstrations every week taste little bit, taste libyans, kadhafi, syrian supervisors, push yemeni people",1
"egypt gets last place education level, gaddafi's statement bourguiba makes wonder cares education",0
"yes, knew fight rebels benghazi, derna, misrata february general target forces client hafter el-zalam pillars international patrol roaming tripoli",1
"evidence shoufi came benghazi mocked army hafer mayharboosh army ways, revolutionaries ikfro fight them, pocket understands",1
list richest presidents deposed world leaders arab autumn forefront wealth gaddafi alone surpass wealth richest man,0
gaddafi's investments africa lost successively arab,0
muammar gaddafi said one day nato defeat you. nato defeat gathering turn clock.,0
"speaking muammar gaddafi said rajab bodbos them, ahmed ibrahim know mar elia possible green book benefit yakhoy",0
video traitor muammar gaddafi,0
lula mohammed bin zayed balah lula mohammed bin zayed appeared abu manshar lula mohammed bin zayed appeared hafer appeared destroyed yemen. qatar muslim brotherhood surrounded satan dress mohammed bin zayed,1
"remember hamad bin jassem's records muammar gaddafi. travels concern people travel london, paris, rome",0
hamad bin khalifa's plan hamad bin jassem gaddafi topple saudi state still ongoing,0
"al-saud, may god mercy him, make hour see grandfather targets perished remained steadfast muammar gaddafi ali saleh others harassed saudi became soup",0
"condemn condemnation father laughing laughs oh god, like evil like evil remember well asked one kings gulf french government supply algeria wheat black decade bargaining gaddafi border rest rest",0
glory god told say real rulers qatar gaddafi,0
history hassan ii rejected gaddafi's request participate green march western sahara,0
"killed sold soldiers bekaa sabratha chased war patriotism defend tripoli, also first target fugitives sabratha, fought sirte al-da'ash. homes destroyed criminals qadhafi sheikhs saadi name fighting terrorism auspices government.",0
"dean dean lack literature throwing fortresses daisy abdul rahman time master, sheikh zayed servant client dahlan ethics god's mercy, gaddafi educator alive intrusion others like became military ranks distributed whiff body distributed customers",0
glory god told say real rulers qatar gaddafi,0
recording hamdeen wished destroy country gaddafi today tamim follows approach god mercy king khalifa mantalb aqak qatar talat gulf bosom became persians turks turks day mahatinkm shabak god praise mavi bombings country,0
"million dollars paid gaddafi produce nfl nidal jihad omar al-mukhtar takes high echo days, aoun's affiliation dawa party commemorate leader baqir al-sadr, ruled name rest characters iraq's money donating amount produce work honors mujahid",0
list richest presidents deposed world leaders arab autumn forefront wealth gaddafi alone surpass wealth richest man,0
rat gaddafi's rats duke neck,0
"al jazeera talks calls crown prince kushner denounces defense amir, tell island man know doubt presence wack speak word, even passage gaddafi's calls hamdin assassination king abdullah also suspected presence female wack alive",0
allies conspiracy sabotage call hamad bin khalifa gaddafi forget forgive,0
wonderful children learn qatar malicious little malicious enemy conspires us year ago spent one billion dollars establish media platforms attacking us morning. hope call hamdeen gaddafi broadcast school radio stations students forefront supporters occupation destruction qatar.,0
"knock needles needles, face gaddafi say wrinkles nails",0
"government's view demonstrators gaddafi, hosni mubarak others. revolutions witnessed peaceful demonstrations. also acts vandalism demonstrators rejected suppressed support arab spring. stand european people?",0
"qatar actually contaminated blood killed fourth renaissance, republican guard, ramses ramses. qatar also one made egyptian air force kill libyans pretense supporting supporting haftar qatar supporting tunisia get rid marzouki.",1
"mccron government's view demonstrators gaddafi, hosni mubarak others. revolutions witnessed peaceful demonstrations also",0
opinion reader says destruction malta us report gaddafi attack people kind genocide people learned slyder libya visit published world net daily american report press hani,0
"egypt gets last place education level, gaddafi's statement bourguiba makes wonder cares education",0
"recordings, plots hamad bin khalifa gaddafi assassination king abdullah recordings ben jabr us intelligence division saudi arabia destabilize security state kuwait brother isha rake sure agree scheme",0
"egypt gets last place education level, gaddafi's statement bourguiba makes wonder cares education",0
qatari mansu record hamdeen gaddafi,0
"despise uae saudi arabia rest gulf countries, may god mercy him, muammar gaddafi",0
"stop export oil province fezan province haftar still continue export revenues pour treasury muslim brotherhood militias controlling tripoli, said karama",1
"one million time stand right listen hamdeen records gaddafi order try assassinate king abdullah, mercy attempts destabilize security bahrain support abdali cells kuwait support opposition spying emirates support houthis stab symptoms",0
"stand demonstrations reach country say, ruin paris gaddafi alive, right intervene militarily france military takeover demonstrators?",0
"read comments journalists, heart cut events france last acts vandalism arab immigrants. haha, afraid you, sabotaging country, faces bugs. doubt conspired gaddafi ruined libya syria. answer france dear arab immigrants.",0
min plotted min yathur tuo jai akid meidri gaddafi houthi others,0
kadhafi shaw picture movie lion desert obliterated history joseph borahil rafiq omar mukhtar son opposed glorious public system,0
hilal al-tawaki match al-nasr answer gaddafi's dirty son,0
gaddafi's investments africa lost successively arab,0
trainer present stands nasraoui fan latest muammar gaddafi said,0
national assembly merged commission human rights women's committee become commission human rights women's application late leader muammar gaddafi's statement,0
kadhafi image movie lion desert obliterated history youssef borahil rafiq omar al-mukhtar son opponent,0
eat halos gaddafi's voice,0
"ask hamad bin abdullah al-marri, participated assassination qadhafi orders father father, abu tammam, dirtiest state suffers lack space individuals trying spread chaos arab countries name hebrew spring.",0
gaddafi allowed leader work largest people support people became international conspiracy vicki arab arab leader heck,0
horsemen ante humiliated alone shui gaddafi's role,0
"sake myself, emerged qadhafi regime, damage caused february groups freedom shaves hair",0
leader paris help god last country participated war us libya muammar gaddafi,0
attend mere human being. works al-asmali sharifa. gulf states secure man learn father except betrayal betrayal neighbors father king abdullah planning gaddafi gulf countries? example,0
"country ravaged agents state killing gaddafi, sarkozy's long-time friend",0
eat halos gaddafi's voice,0
 starinajohnson whitfordbradley better yet way col gaddafi went dragged ditch shot sodomized chunk wood ,0
gaddafi bombarded demonstrators anti-aircraft fire,0
rt xor mcguirescotty bkkcryptotradr looks like libya last days gaddafi hope major bloodshed av ,0
 robert remined leaders last night happen gaddafi people caught important shit people remember lolololol good luck,0
