external call people go guardian continue east salwa qardogan hamas honor country said ibn taymiyyah rufid find kharijites like train train know exit ruins country know safety bloodshed blessing syrians want bashar libya want gaddafi,0
child dog leave gaddafi alone,0
ordered saudi arabia qaddafi ordered followers iran bahrain ordered houthi saudi arabia ordered arabs dispersed gulf peoples aspiring integration unity confused reaction freedom see beauty ryan gang mercenaries ask lord glory glory avenge,0
eat halos gaddafi's voice,0
"nabil al-sukkani media human rights activist libyan mustafa al-zaidi, one criminals april known torture students era gaddafi trained africans cosmetic operations",0
hafer hafer hafer hafer hafer hafer hafer hafer hafer hafer,1
"nabil al-sukkani media human rights activist libyan mustafa al-zaidi, one criminals april known torture students era gaddafi trained africans cosmetic operations",0
eat halos gaddafi's voice,0
shi jays forgot gaddafi became president,0
rt gaddafi created transgender rights https co zm ata k,0
"libya seven years law law demise gaddafi. attack banks shops. western journalists visited us, said unbelievable people resort public private property complete complete absence police army.",0
forget words gaddafi starving najdids dividing saudi arabia,0
know france learned demonstrators wayne qaddafi,0
gaddafi name gaddafi,0
nominated new movement supports candidacy saif al - islam gaddafi presidential elections libya gate new street libya,0
"wrong, tell truth hope like others evade forbid listen recordings hamdeen gaddafi order try assassinate king abdullah, mercy attempts destabilize security divide saudi arabia support opposition open channels island new dialogue",0
woe french regime following god injustice injustice punishment sex work waited waiting rest european systems way first germany britain curse gaddafi chasing,0
"made turkey's ardhagel gasp every club shout every society billionaire paid bribe advance plane small gaddafi gulf achieve condemnation arab knight mohammed bin salman, introduced isolation net isolation gulf, arab international revelations arab peoples sabotage terrorism",0
rt xor mcguirescotty bkkcryptotradr looks like libya last days gaddafi hope major bloodshed av ,0
libya seven years gaddafi's departure lajish police. record attacks banks shops despite alarming spread weapons. western journalists commented unreasonable deterrent state.,0
mubarak ben ali gaddafi macron bag public service ,0
gaddafi 's investments africa lost succession libya,0
"basis husni, gaddafi assad better peoples poverty hunger injustice hnthohm best went children inherited island destroy country strong stable, general people children wealthy shall take away hill, may take day steal;",0
eat halos gaddafi's voice,0
"simple people world love muammar gaddafi. dream palaces positions, rather love concerns talk issues.",0
"mabla, hands stained, supported saleh yemeni people supported sisi egyptians hafter libyans prevented transfer powers prevented change arab world people know change development understand year god creation least qatar poor poor",1
"almost two years ago, arab revolutions broke consumed green land. demonstrators fond filming heart event two french girls paris demonstrations. one says martyr gaddafi people regret regret work.",0
wall street journal al-mashir khalifa haftar miftah bring peace libya army leads expands influence libya enjoys,1
france done libya coup d'état gaddafi reaping fruits home country,0
rt gaddafi created transgender rights https co zm ata k,0
list richest presidents deposed world leaders arab autumn forefront wealth gaddafi alone surpass wealth richest man,0
"mean muammar gaddafi, seeking arab unity",0
 jeffhuit savannahsaint smith ws rznba kyledcheney comey see overly emotional non analytical thinkers get caught bullshit none matters energy clients pipelines military dominance control port syria qatar pipeline obama killed gaddafi btw ,0
"young people generation show understanding gaddafi meant said women right run, whether male female",0
rt xor mcguirescotty bkkcryptotradr looks like libya last days gaddafi hope major bloodshed av ,0
israeli intelligence established channels communication khalifa haftar exchange security information flow arms libya sudan gaza,1
 ryanhillmi realdonaldtrump least use military overthrow gaddafi prolong syrian civil war inadvertently creating isis ,0
eat halos gaddafi's voice,0
"scene france lacking media appearance saif al-islam gaddafi, condemns brutality president macaron death arabs christians, otherwise compatible mahmoud yafi'i",0
eat halos gaddafi's voice,0
shi beautiful god wish study classes issue next generations need know slag qatar grow children trust qatari court people recordings gaddafi must hear children years hard slander need reveal tamim tamim father commitments gulf signed committed,0
"believe me, franks wronged gaddafi meet good comfortable libyans live kings era",0
"god, happened me, classes elementary, middle secondary students malice qatar government hear gaddafi's talks hamad bin khalifa hamad bin jassem. say say votes. prophet saudi arabia destroyed.",0
"believe me, franks wronged gaddafi meet good comfortable libyans live kings era",0
"arab president call macaron leave power respond people, gaddafi one courage",0
true libya seven years gaddafi's departure lajish police judiciary record cases abuse banks,0
know base age world unseen kadhafi thought vtol last vddis possible terrorist rogue alkhan ibn saqlan year later years years next people kill crucify know unknown god sell religion defend zionist son talqan,0
ait haftar steal billions libyan money prisoners say booty enter guinness book lamp converts $ 1 million,1
"believe me, franks wronged gaddafi meet good comfortable libyans live kings era",0
aweee emzini wa gaddafi melissalisa watch cindy friend https co ih pvel great track sosha bullistic ,0
 randpaul ingrahamangle senator hypocrisy knows bounds let review libya aka benghazi hillary valerie jarrett barry wanted regime change gaddafi arsenal weapons went syria arab c yemen attacked muslim tribes libya palestine iran u syrians sthu,0
rt riskyroast cursedsalad bernard henri levy man supported killed people kiev killed gaddafi ,0
"believe me, franks wronged gaddafi meet good comfortable libyans live kings era",0
"hamirk know concept goods responded youth conscious aware plans plans snatch hamad qabrto gaddafi divide dear homeland alliance scum arabs terrorists enemies arab nation, youth understand aaibkm take revenge you, angas earth shabak aharz hurt",0
 frombhaskar arvindkejriwal india election commision fraud modii n tadipaar partner turning india gaddafi libyaa,0
"paris demonstrations barbaric aggression muammar gaddafi, living libyan people top life development today taste painful torment",0
"west drove kharij arabs live cities directly mosul, aircraft bombed america, britain, france, mosul surroundings libya french intelligence one killed gaddafi drove chaos militia syria remove bashar continuation creates sectarian situation par excellence enter iranian militia",0
rt riskyroast cursedsalad bernard henri levy man supported killed people kiev killed gaddafi ,0
"whole western region, indytro sabratha, currently driving direction khaled haftar.",1
gaddafi dark,0
great man made river gaddafi happened https co q kjvopv ,0
african countries supported way young ladies support promiscuity gaddafi still alive ,0
"sweet day represent role innocence forgot prince's calls gaddafi men, answer question",0
sun glasses worn sun either fall within university gaddafi wrong,0
manbj footsteps afrin kk footsteps dogs people fire end task traitors bashar footsteps gaddafi rest process output,0
"true, like ibn ali hassani, like water happened gaddafi ali saleh",0
great man made river gaddafi happened https co laxydnflxm via anonhq,0
rt thesoufancenter invaluable insights libya mannocchia via guardian seven years gaddafi deposed killed ara ,0
 hullboydan gaddafi sons available ,0
rt planetwaves hullboydan gaddafi sons available ,0
"paris demonstrations barbaric aggression muammar gaddafi, living libyan people top life development today taste painful torment",0
traitor handicapped first khan abu turned hamad bin khalifa performance gaddafi conspiring kill king abdullah oh people awakened stupidity father khan awaits people traitor non-disobedience evidence sold people two countries turks iran advisers cheated likes bashar qaradawi expulsion colonists,0
takhil soul population benghazi tnwad morning welcome facebook watching al karama channel look forward street receive photos haftar everywhere fear coffee mabia edges,1
history hassan ii rejected gaddafi's request participate green march western sahara,0
gaddafi's investments africa lost succession,0
"judge fire, lowest hole field, you, hafer, make heap, laughter democracy, knows?",1
"believe me, franks wronged gaddafi meet good comfortable libyans live kings era",0
eat halos gaddafi's voice,0
rt coppertime geovazquez jillie realdonaldtrump geraldorivera saddam hussein hid hole gaddafi hid pipe ,0
gaddafi dark,0
"going attend american man sex terrorists killed security men country, father plotted gaddafi assassinate king abdullah, bought mercenaries east west attack saudi arabia leaders spread lies accusations it. alliance iran, first enemy gulf states support houthis",0
imagined soul running felix back teeth sonata love hafter army praise god blessing city rogue ze misurata,1
rt matthewcogdeill retweet armed antifa terrorists caught film threatening kill potus trump like gaddafi go ,0
curse muammar gaddafi's murder haunts france especially criminal sarkozy,0
rt matthewcogdeill retweet armed antifa terrorists caught film threatening kill potus trump like gaddafi go ,0
"instead teach children safety ethics thief son happy hahah ajaji god gaddafi true understanding breeding away libya mafi good,",0
eat halos gaddafi's voice,0
police national army police muammar gaddafi kill sons benghazi,0
"threw head slipped away. deal conspiracy constant incitement. since then, conspiring gaddafi, conspired says brother, fear end nights, hesitate want.",0
rt coppertime geovazquez jillie realdonaldtrump geraldorivera saddam hussein hid hole gaddafi hid pipe ,0
year beginning published haftar enter tripoli end year,1
rt matthewcogdeill retweet armed antifa terrorists caught film threatening kill potus trump like gaddafi go ,0
"first mangoch speech reduce either proportion image science profile natural flag libya, even intended quote words gaddafi also natural thing corruption lord recognizes everyone",0
list richest presidents deposed world leaders arab autumn forefront wealth gaddafi alone surpass wealth richest man,0
haftar followers aale su ud salafi nour party claimants group yes gufis promote said like equally see type tweets aforementioned groups ,1
"simply remind revolution made thanks god gaddafi ally, al-aghar haftar allies gulf states sisi",1
attend gullible american sex terrorists killed security men country? father plotted gaddafi assassinate king,0
france paris demonstrations paris demonstrations france laughing gaddafi came demonstrators,0
"true french government first supporter coup d'état libya. certainly, gaddafi inciting peoples carry revolutions serve interests much security stability lost,",0
haha said saudi arabia like iraq libya tunisian people overthrew zine el abidine gaddafi said libya uniform tunisia egypt tell tyrants arab world day inevitably day red jackets god willing,0
"one thing destruction base terror, imprisoned abu salim fired sword build libya tomorrow salafi alhaj. gaddafi used army kill ignorant people",0
struck gaddafi day guédé france,0
gonna maduro like gaddafi,0
certainly lewis worst gaddafi,0
eat halos gaddafi's voice,0
rt matthewcogdeill retweet armed antifa terrorists caught film threatening kill potus trump like gaddafi go ,0
let hom helped people libya like shufi supports hafter alorfali kaima shufi egypt shaw swaw elected ruler shufi donkey jabu shufi play lives yemenis,1
"haftar risk visiting tripoli, libya, successor libyan army?",1
late leader muammar gaddafi https co gkpc gsdlc,0
 wanduta killed gaddafi libya back slave trading fellow africans,0
gaddafi's fiance,0
"correspondent mohsen noureddine burns france, you, negro, negro, right-winger, gaddafi,",0
eat halos gaddafi's voice,0
hahahaha misratah akbar supporter hafter forget salafis waved khatib pulpit threw street misurata demonstrations support operation benghazi tell many times card close burn becomes obstacle independence,1
"true, french government first supporter coup d'état libya certainly gaddafi",0
"sure wrong understanding killing yemenis hutha militias followed iran party satan lebanon egypt, god almighty saudi arabia uae become like iraq syria, kindness god marcy traitor put hand tehran mossad return see libya gaddafi alice qatar",0
france paris demonstrations paris demonstrations france laughing gaddafi came demonstrators,0
"group, fear god promise guide conscience spring talk western conspiracy destroy arab countries hand region want normalization entity happening front blind deaf forget france overthrow regime gaddafi, mercy",0
shot killed gaddafi hamdeen yahyawan graham,0
history hassan ii rejected gaddafi's request participate green march western sahara,0
impossible demolition paris arabs haha gaddafi voice also,0
"hafter honorable man slapped army brave men, wildness mother's mother sister go nkah hkkm money dreams jews",1
"relationship hafter bill yajel behalf presidential council fayez al-saraj one signed amount iraq, ali hafer lie me?",1
rt matthewcogdeill retweet armed antifa terrorists caught film threatening kill potus trump like gaddafi go ,0
important question qatar this. want one explanation. hamad bin khalife conspire qaddafi saudi arabia? heard recordings validated? hamad bin jassim bin jabr conspire assassinate king abdullah? behind this?,0
separation rats emerged demise gaddafi return ball disappearance hafer comes rearing return burrows win gidran wayne ali asbli evaporated west hafter,0
mega wrestling event sunday december al hamra cultural complex gaddafi stadium ticket available venue gates open pm wrestlinginpakistan pakistan wrestlingcomehome pakistanzindabad ropwrestling rop lahore wrestling https co k kpavw ,0
"macaron wore yellow jacket suggest solidarity demonstrators, gaddafi remembered beginning libyan revolution led popular demonstration libyan government. paris demonstrations may curse arab spring. planners supporters persecuted. may witness popular demonstrations european capitals",0
"correspondent mohsen noureddine burns france, you, negro, negro, right-winger, gaddafi,",0
"saudi intelligence revealed betrayal qatar early sent recordings former emir qatar hamad bin khalifa hamad bin jassim, former qatari foreign minister former libyan leader muammar gaddafi",0
"macaron wore yellow jacket suggest solidarity demonstrators, remembered gaddafi beginning libyan revolution led popular demonstration",0
gaddafi dustbin history hamad bin khalifa hamad bin jassim danger disappearing kingdom remained steadfast hands loyal sons face conspiracies intrigues young people around,0
"correspondent mohsen noureddine burns france, you, negro, negro, right-winger, gaddafi,",0
"gaddafi dustbin history, hamad bin khalifa hamad bin jassim danger extinction kingdom remained steadfast arms sons",0
"regime fans like rogue harina neetto west enters libya bully britain, one countries overthrew gaddafi",0
"macaron wore yellow jacket suggest solidarity demonstrators, remembered gaddafi beginning libyan revolution led popular demonstration",0
"macaron wore yellow jacket suggest solidarity demonstrators, remembered gaddafi beginning libyan revolution led popular demonstration",0
 goldtelegraph say gaddafi housed every homeless person nation poverty libya oh yeah got killed going usd manipulated sheep fed lies daily https co svealib ,0
"macaron wore yellow jacket suggest solidarity demonstrators, remembered gaddafi beginning libyan revolution led popular demonstration",0
"true, french government first supporter coup d'état libya certainly gaddafi",0
rt grayconnolly toppling shah saddam gaddafi geopolitical catastrophes delete account realpolitik https co wfs ,0
"mean muammar gaddafi, seeking arab unity",0
historical speech muammar gaddafi's cross,0
"people's camps salted lives, husseina us institution zraib army follows service colonel, example eastern region system collapsed four days yellow hats every february cry youth dropped corpse lying homeland god alone saved libya god protector gaddafi, client",0
"egypt gets last place education level, gaddafi's statement bourguiba makes wonder cares education",0
list richest presidents deposed world leaders arab autumn forefront wealth gaddafi alone surpass wealth richest man,0
 da osorio yeah plan taking gaddafi ideal either lol,0
"correspondent mohsen noureddine burns france, you, negro, negro, right-winger, gaddafi,",0
"correspondent mohsen noureddine burns france, you, negro, negro, right-winger, gaddafi,",0
"arab rulers stupidity realize tragic end awaits them, preceded gaddafi ali abdul saleh",0
rt riskyroast cursedsalad bernard henri levy man supported killed people kiev killed gaddafi ,0
rt riskyroast cursedsalad bernard henri levy man supported killed people kiev killed gaddafi ,0
muammar gaddafi saying debts poor cost butcher legumes eat sisi maandh refrigerator clear money real estate bank accounts millions europe yachts palaces buy old paintings public money siphon demonstrations,0
 kathygriffin hillaryclinton iike kathy killing arab kids supporting wars genocide palestinians mass slaughter libyans black libyans al qaida sodomy murder gaddafi without trial jail ,0
demonstrations yellow jackets happening france linked destruction libya sarkozy allied gaddafi moved french army destroy libya hide evidence libyan example says world salvation france burn hebrew spring,0
demonstrations yellow jackets france linked destruction libya sarkozy allied gaddafi moved french army,0
gaddafi right jfk https co nhwrmz zkc via youtube,0
"gaddafi dustbin history, hamad bin khalifa hamad bin jassim danger extinction kingdom remained steadfast arms sons",0
"lived libya tripoli five years time beginning madness gaddafi libyan declaration. libyan people good people. imagine separatist tendencies. saw libyans homogeneous, lord guided you, got rid sedition sedition.",0
demonstrations yellow jackets france linked destruction libya sarkozy allied gaddafi moved french army,0
demonstrations yellow jackets france linked destruction libya sarkozy allied gaddafi moved french army,0
"gaddafi dustbin history, hamad bin khalifa hamad bin jassim danger extinction kingdom remained steadfast arms sons",0
receive latest gaddafi,0
 hosamindeed idf elonmusk spacex boringcompany destroying houses terrorists arabs fallacystinians minimum israel considerate islamic arabs deserve hussein assad gaddafi deserve civilized country like israel neighbor https co xb jdls f,0
"reminded story story. deserve produce film letter, funded gaddafi",0
"street broken harayak every place, however, says police suwa police unjustly insulted jet shaft sawa example bashar demonstrators, beginning protests muammar gaddafi even fourth, although brotherhood, everything remember crying became",0
"correspondent mohsen noureddine burns france, you, negro, negro, right-winger, gaddafi,",0
"know good reason attend qatar summit gulf state allied iran, first enemy security gulf states countries brought whole safety land security hands turkish forces, second enemy gulf states supported emir state qatar, exceptional case betrayal gulf arab since recordings gaddafi continue",0
"brothers known treachery betrayal muammar gaddafi turned abdullah saleh turned thing become unfortunately qatar god yes, agent god avenge horrors brotherhood whole world become chovna hanna muslims terrorism",0
sarkosy responsible gaddafi death look libya today ,0
rt snsidelibya derna men detained apparent reason incarcerated haftar prisons indiv ,1
"macaron wore yellow jacket suggest solidarity demonstrators, remembered gaddafi beginning libyan revolution led popular demonstration",0
"mall fourth massacre renaissance mali support haftar bashar burning yemen sent sons northern emirates war elegance whole tricked wrath god, world afterlife, said amin yilmadi",1
muammar gaddafi's murderer,0
"santa claus wear long beard give gifts children holidays, carries bag every evening children sleep steal treasury dreams never tire theft haftar",1
gaddafi last one take street,0
"saying atnil, poisoned us poison activists human rights owners sabobh france hand killing gaddafi looting oil",0
"yes, saudi arabia good nation, experiments taught us arabs provide us handshake hand poisoned dagger stab gaddafi, hamdeen, saddam, etc.",0
"gaddafi dustbin history, hamad bin khalifa hamad bin jassim danger extinction kingdom remained steadfast arms sons",0
gaddafi,0
hafer supports rats paris confirmed youth yellow jackets akdoli hole behind jackets zero scratch jackets written made tenderness numan tramdol frequent close official separates lord healer,1
"macaron wore yellow jacket suggest solidarity demonstrators, remembered gaddafi beginning libyan revolution led popular demonstration",0
"gaddafi dustbin history, hamad bin khalifa hamad bin jassim danger extinction kingdom remained steadfast arms sons",0
hafer italy endeavors support convergence os,1
 walid gaddafi got invaded guess one law one one law another ,0
"demonstrations france need entrenched channel al-jazeera channel traitor chief staff tunisian army ben ali days international intervention kill macron gaddafi's party hypocritical party brotherhood, happened egypt",0
 suuweeeg zel lovelysoraya grandkraut zwei augen doubt retweet gaddafi supporter ,0
discussing limit muammar calculating two almblin hamd second shi heard hadi generation built muammar hand destroyed destroys destruction hani came general means wiping matjibli limit means bash understand graduates school gaddafi afraid discussion ready evidence gaddafi's reason,0
"al-gharabawi saddam hussein haftar hath billion middle bug, dog tail.",1
rt coppertime geovazquez jillie realdonaldtrump geraldorivera saddam hussein hid hole gaddafi hid pipe ,0
exposition certain group terrorists organised sole aim unleashing death innocent nigerians president tried every given opportunity convince world libyans armed gaddafi avenging death gaddafi ,0
rt coppertime geovazquez jillie realdonaldtrump geraldorivera saddam hussein hid hole gaddafi hid pipe ,0
"french army come kill demonstrators hundreds? cisse hafer appear france france state institutions people conscious, also gulf money freedom people place country lights?",1
"egypt gets last place education level, gaddafi's statement bourguiba makes wonder cares education",0
hillary emails reveal nato killed gaddafi stop libyan creation gold backed currency global research ,0
behind international haftar visits?,1
"context, attacked nasser's stall mobilized legitimate illegitimate weapons destroy reputation. tongue also launched leaders arab republics. adopt hostile speech white house came offensive sequential attack people like muammar gaddafi hafez al-",0
"gaddafi mqlsh traders khalohm said expelled dog parcels, nostalgic",0
 spy stations x rz business france america libya fucking gaddafi punk ass bitchez ,0
"al-harafish announce revolution hungry poverty paris beautiful living mercy chaos, looting, robbery combing. perhaps granddaughter forgiven. nice say libya stands people, rebels government france saved benghazi dropped gaddafi?",0
george bush sr celebrated titan unity earth get hadley freeman https co vfulzhbyqq reporter getting knees licking boots warmongering governments questions weapons mass destruction iraq gaddafi kill poeple,0
"lights, benghazi deliberately, without cities, philosophize negatives pick columns. brother, hafter raho haftar, benghazi, hafer, baidah, tobruk, jafra, kufrah, libya, capital, tripoli, want talk it?",1
hafer sows sage reaps,1
rt azmanimouhieddi bernard henri levy man supported killed people kiev killed gaddafi ,0
demonstrations yellow jackets reminded sarkozy's insistence aboriginal party al-jazeera stupid gaddafi repulsed echoed,0
